{
  "content_version": "1.0",
  "product_id": "PPL-BODY-CLOSET-001",
  "source": "factory-generator",
  "generated_at": "2026-09-02T22:41:17.341Z",
  "hero": {
    "title": "The New-Body Closet",
    "subtitle": "A Practical Wardrobe System for Postpartum Women Who Are Done Waiting to Get Their Body Back",
    "one_line_promise": "Knows how to dress her current body, builds outfits quickly, feels put-together again."
  },
  "short_description": "Knows how to dress her current body, builds outfits quickly, feels put-together again.",
  "trust_line": "Educational content - not medical, clinical, or mental-health advice.",
  "evidence_label": "Educational content informed by practical and lived experience. It is not a substitute for medical, clinical, or mental-health assessment."
}
