{
  "content_version": "1.0",
  "product_id": "PPL-PELVIC-QUIET-001",
  "source": "factory-generator",
  "generated_at": "2026-09-02T22:41:32.461Z",
  "hero": {
    "title": "The Quiet Leak",
    "subtitle": "A Private, Evidence-Based Guide to Understanding and Improving Postpartum Bladder Control",
    "one_line_promise": "Understands it deserves attention, has a safe pelvic-floor progression, knows when to seek professional assessment."
  },
  "short_description": "Understands it deserves attention, has a safe pelvic-floor progression, knows when to seek professional assessment.",
  "trust_line": "Educational content - not medical, clinical, or mental-health advice.",
  "evidence_label": "Educational content informed by practical and lived experience. It is not a substitute for medical, clinical, or mental-health assessment."
}
